{
  "集": 1,
  "视频": "videos/sample/E01.mp4",
  "时长": "00:20.0",
  "镜头": [
    {
      "id": "E01-K001",
      "起": "00:00.0",
      "止": "00:05.0",
      "帧": [
        {
          "文件": "K001_01.jpg",
          "时间": "00:00.0"
        },
        {
          "文件": "K001_02.jpg",
          "时间": "00:02.0"
        },
        {
          "文件": "K001_03.jpg",
          "时间": "00:04.0"
        }
      ]
    },
    {
      "id": "E01-K002",
      "起": "00:05.0",
      "止": "00:10.0",
      "帧": [
        {
          "文件": "K002_01.jpg",
          "时间": "00:05.0"
        },
        {
          "文件": "K002_02.jpg",
          "时间": "00:07.0"
        },
        {
          "文件": "K002_03.jpg",
          "时间": "00:09.0"
        }
      ]
    },
    {
      "id": "E01-K003",
      "起": "00:10.0",
      "止": "00:15.0",
      "帧": [
        {
          "文件": "K003_01.jpg",
          "时间": "00:10.0"
        },
        {
          "文件": "K003_02.jpg",
          "时间": "00:12.0"
        },
        {
          "文件": "K003_03.jpg",
          "时间": "00:14.0"
        }
      ]
    },
    {
      "id": "E01-K004",
      "起": "00:15.0",
      "止": "00:20.0",
      "帧": [
        {
          "文件": "K004_01.jpg",
          "时间": "00:15.0"
        },
        {
          "文件": "K004_02.jpg",
          "时间": "00:17.0"
        },
        {
          "文件": "K004_03.jpg",
          "时间": "00:19.0"
        }
      ]
    }
  ]
}
